{"host_protocol":"static-json-query-schema-submit-v1","path_base":"task_root","required_call_schedule":["query_greeks_task_contract_v1","query_greeks_task_inputs_v1","submit_greeks_submission_v1"],"resource_budget":{"submission_bytes":5242880,"submission_calls":1,"trusted_query_calls":2},"task_id":"bsm-mig-v1-6d61664bf040831737832269","tools":[{"arguments_schema":{"additionalProperties":false,"maxProperties":0,"type":"object"},"kind":"static_json_query","max_calls":1,"name":"query_greeks_task_contract_v1","payload_digest":"cbccbea9714ab6f941e74c1f94ec1065d78ad07d096f3305a3671b56744ae397","payload_path":"trusted_tools/payloads/contract.json"},{"arguments_schema":{"additionalProperties":false,"maxProperties":0,"type":"object"},"kind":"static_json_query","max_calls":1,"name":"query_greeks_task_inputs_v1","payload_digest":"598b596326fafa4661c70cd747920c0b9805c2be45d693ac29fa1a4b672d5b6f","payload_path":"trusted_tools/payloads/inputs.json"},{"canonical_serialization":"utf8-sort-keys-compact-newline-v1","kind":"schema_validated_submission_sink","max_calls":1,"name":"submit_greeks_submission_v1","row_id_sequence_constraint":{"contiguous":true,"decimal_width":6,"increment":1,"prefix":"row_","row_id_field":"row_id","rows_field":"rows","start":1},"submission_schema_dialect":"https://json-schema.org/draft/2020-12/schema","submission_schema_digest":"3ec8cba7ca84d2c2130ff6f07a421571776e58cf1edb5f922ce2eb2f3864c9d0","submission_schema_path":"public/submission.schema.json","task_id_constraint":"bsm-mig-v1-6d61664bf040831737832269"}],"toolset_schema_version":"bsm-greeks-portable-toolset-v1.0.0"}
